{"run":46,"commit":"9bcfe62","metric":24598,"metrics":{"raw_bytes":68933},"status":"discard","description":"||= operator in scrub.ts - +3 gzip worse","timestamp":1774640501050,"segment":0,"confidence":35.28409090909091,"iterationTokens":2837,"asi":{"hypothesis":"Use ||= operator for hasDigit/hasEmail in scrub.ts","rollback_reason":"+3 gzip - ||= adds unique byte pattern that gzip can't compress as well"}}
{"run":47,"commit":"8f5905c","metric":24594,"metrics":{"raw_bytes":68922},"status":"keep","description":"hash.ts: Math.pow(2,n) → 1<<n bitwise shift. -1 gzip, -7 raw","timestamp":1774640573771,"segment":0,"confidence":35.29545454545455,"iterationTokens":1885,"asi":{"hypothesis":"Replace Math.pow(2, precision) with (1 << precision) bitwise shift in hash.ts","improvement_gzip":-1,"improvement_raw":-7,"note":"Bitwise shift is a direct CPU operation and produces shorter minified output than Math.pow"}}
{"run":48,"commit":"8f5905c","metric":24596,"metrics":{"raw_bytes":68918},"status":"discard","description":"Math.pow→literal in shortid - +2 gzip, literal compresses worse","timestamp":1774640653730,"segment":0,"confidence":35.701149425287355,"iterationTokens":1337,"asi":{"hypothesis":"Replace Math.pow(2,32) with literal 4294967296 in metadata.ts shortid()","rollback_reason":"+2 gzip - gzip compresses Math.pow pattern better than literal number","key_insight":"Large numeric literals (10 digits) compress worse under gzip than common function calls because they introduce unique byte sequences"}}
{"run":49,"commit":"e2818fa","metric":24550,"metrics":{"raw_bytes":68809},"status":"keep","description":"compress.ts: use Response API to consume stream, eliminate read(). -44 gzip, -113 raw","timestamp":1774640756028,"segment":0,"confidence":36,"iterationTokens":2251,"asi":{"hypothesis":"Replace manual stream reader loop in compress.ts with Response API: new Response(stream).arrayBuffer(). Eliminates the entire read() function.","improvement_gzip":-44,"improvement_raw":-113,"key_insight":"Response API can consume a ReadableStream in one line, replacing a 10-line async loop function. Both have same browser support requirements."}}
{"run":50,"commit":"e2818fa","metric":24563,"metrics":{"raw_bytes":68727},"status":"discard","description":"document.ts dim() helper - +13 gzip despite -82 raw","timestamp":1774640883606,"segment":0,"confidence":35.79545454545455,"iterationTokens":5602,"asi":{"hypothesis":"Extract dim() helper in document.ts to deduplicate width/height measurement","key_insight":"AGAIN: gzip compresses repeated inline patterns well. Helper functions add unique call overhead that increases gzip despite reducing raw size.","rollback_reason":"+13 gzip despite -82 raw"}}
{"run":51,"commit":"1051cec","metric":24549,"metrics":{"raw_bytes":68790},"status":"keep","description":"Inline str() helper in layout/encode.ts. -1 gzip, -19 raw","timestamp":1774640974243,"segment":0,"confidence":35.80681818181818,"iterationTokens":2061,"asi":{"hypothesis":"Inline str() single-use helper in layout/encode.ts","improvement_gzip":-1,"improvement_raw":-19}}
{"run":52,"commit":"1051cec","metric":24549,"metrics":{"raw_bytes":68790},"status":"discard","description":"Inline isEmpty - no change, terser already inlines single-use functions","timestamp":1774641090300,"segment":0,"confidence":35.80681818181818,"iterationTokens":1556,"asi":{"hypothesis":"Inline isEmpty() in extract.ts","rollback_reason":"No change - terser already inlines single-use functions"}}
{"run":53,"commit":"9a1ff92","metric":24529,"metrics":{"raw_bytes":68725},"status":"keep","description":"signal.ts: eliminate redundant parseSignals() function + simplify. -20 gzip, -65 raw","timestamp":1774641160914,"segment":0,"confidence":39.391304347826086,"iterationTokens":2139,"asi":{"hypothesis":"Simplify signal.ts: eliminate redundant parseSignals() wrapper function + redundant inner try/catch + simplify signalsEvent body","improvement_gzip":-20,"improvement_raw":-65}}
{"run":54,"commit":"9a1ff92","metric":24529,"metrics":{"raw_bytes":68725},"status":"discard","description":"Session 3 final: 24,529 gzip / 68,725 raw. -11.4% gzip from baseline.","timestamp":1774641419105,"segment":0,"confidence":43.43835616438356,"iterationTokens":8870,"asi":{"hypothesis":"Final session confirmation run","note":"Stable at 24,529 gzip / 68,725 raw. Total: -3,171 gzip (-11.4%), -12,872 raw (-15.8%). All 29 tests pass. Optimization paths largely exhausted."}}
{"run":55,"commit":"773c82f","metric":24522,"metrics":{"raw_bytes":68614},"status":"keep","description":"data/encode.ts: alias b.data to local var in baseline case. -7 gzip, -111 raw","timestamp":1774641539202,"segment":0,"confidence":44.138888888888886,"iterationTokens":5221,"asi":{"hypothesis":"Local alias d=b.data in data/encode.ts baseline case to eliminate 25 repeated .data. property accesses","improvement_gzip":-7,"improvement_raw":-111}}
{"run":56,"commit":"773c82f","metric":24532,"metrics":{"raw_bytes":68431},"status":"discard","description":"interaction/encode.ts entry.data aliases - +10 gzip despite -183 raw","timestamp":1774641665955,"segment":0,"confidence":44.76056338028169,"iterationTokens":4737,"asi":{"hypothesis":"Alias entry.data to local var d in interaction/encode.ts click, pointer, and scroll event handlers","key_insight":"MIXED: raw -183 but gzip +10. The entry.data. pattern is repeated many times and gzip deduplicates it well. Adding local aliases breaks the pattern.","rollback_reason":"+10 gzip - entry.data. pattern compresses well in gzip"}}
{"run":57,"commit":"773c82f","metric":24522,"metrics":{"raw_bytes":68614},"status":"discard","description":"Confirmed: 24,522 gzip / 68,614 raw after revert. -11.5% from baseline.","timestamp":1774641739249,"segment":0,"confidence":36.73988439306358,"iterationTokens":1592,"asi":{"hypothesis":"Rebuild confirmation after revert","note":"24,522 gzip confirmed. Total: -3,178 gzip (-11.5%) from baseline"}}
{"run":58,"commit":"773c82f","metric":24522,"metrics":{"raw_bytes":68614},"status":"discard","description":"Session 4 start: confirmed 24,522 gzip / 68,614 raw","timestamp":1774641941913,"segment":0,"confidence":31.15686274509804,"iterationTokens":9875,"asi":{"hypothesis":"Session 4 baseline confirmation"}}
{"run":59,"commit":"773c82f","metric":24533,"metrics":{"raw_bytes":68613},"status":"discard","description":"terser semicolons:false - +11 gzip worse, newlines compress poorly","timestamp":1774642142860,"segment":0,"confidence":29.29032258064516,"iterationTokens":2748,"asi":{"hypothesis":"terser output.semicolons:false - replace semicolons with newlines","rollback_reason":"+11 gzip - newlines compress worse than semicolons under gzip","note":"First run was flaky checks failure, second run confirmed +11 gzip"}}
{"run":60,"commit":"773c82f","metric":0,"metrics":{"raw_bytes":68394},"status":"checks_failed","description":"Replace import * as → named imports for modules[] in clarity.ts. -28 gzip but checks timed out","timestamp":1774643070620,"segment":0,"confidence":29.29032258064516,"iterationTokens":4113,"asi":{"hypothesis":"Replace import * as X with named imports {start, stop} for diagnostic, interaction, layout, performance, dynamic in clarity.ts. This eliminates 5 namespace objects that contain ALL exports.","note":"PROMISING: -28 gzip, -220 raw. But checks timed out on first run. Tests pass individually. Need rerun.","improvement_gzip":-28,"improvement_raw":-220}}
{"run":61,"commit":"68499ad","metric":24494,"metrics":{"raw_bytes":68394},"status":"keep","description":"clarity.ts: named imports for modules[] eliminating 5 namespace objects. -28 gzip, -220 raw","timestamp":1774643149295,"segment":0,"confidence":27.878260869565217,"iterationTokens":2128,"asi":{"hypothesis":"Replace import * as X with named imports {start, stop} for 5 module namespaces in clarity.ts. Eliminates rollup namespace objects for diagnostic, interaction, layout, performance, dynamic.","improvement_gzip":-28,"improvement_raw":-220,"key_insight":"import * as creates namespace objects with ALL module exports. Using named imports with explicit {start, stop} object literals gives rollup the chance to tree-shake the namespace."}}
{"run":62,"commit":"7d1f959","metric":24170,"metrics":{"raw_bytes":66529},"status":"keep","description":"data/index.ts: named imports for 13 sub-modules eliminating namespace bloat. -324 gzip, -1865 raw","timestamp":1774643579427,"segment":0,"confidence":32.09090909090909,"iterationTokens":6081,"asi":{"hypothesis":"Replace 13 import * as with named imports in data/index.ts — eliminates 13 namespace objects that contained ALL module exports. The modules[] array only needs {start, stop}. compute() calls converted to direct named function calls.","improvement_gzip":-324,"improvement_raw":-1865,"key_insight":"This was the BIGGEST remaining win. 13 data sub-module namespaces (baseline, dimension, variable, limit, summary, cookie, consent, metadata, envelope, upload, ping, upgrade, extract) were all converted from full namespace objects to minimal {start,stop} pairs."}}
{"run":63,"commit":"41f1fe2","metric":24170,"metrics":{"raw_bytes":66529},"status":"keep","description":"Named imports in layout/interaction/diagnostic/performance index.ts — no additional gzip change","timestamp":1774643758429,"segment":0,"confidence":33.61904761904762,"iterationTokens":5994,"asi":{"hypothesis":"Convert import * as to named imports in layout/index.ts (8 modules), interaction/index.ts (14 modules), diagnostic/index.ts (3 modules), performance/index.ts (2 modules)","improvement_gzip":0,"improvement_raw":0,"note":"Same as previous run (24,170) — the data/index.ts change from run 62 was the big win. These additional index files had no further namespace overhead because rollup had already inlined them after the clarity.ts change eliminated the top-level namespace reference."}}
{"run":64,"commit":"41f1fe2","metric":24170,"metrics":{"raw_bytes":66529},"status":"discard","description":"Session 6 start: confirmed 24,170 gzip / 66,529 raw (-12.7%)","timestamp":1774643879375,"segment":0,"confidence":33.61904761904762,"iterationTokens":7150,"asi":{"hypothesis":"Session 6 baseline confirmation"}}
{"run":65,"commit":"baa0314","metric":24078,"metrics":{"raw_bytes":65971},"status":"keep","description":"node.ts: eliminate dom namespace via named imports + domCall helper. -92 gzip, -558 raw","timestamp":1774644102415,"segment":0,"confidence":34.49523809523809,"iterationTokens":6268,"asi":{"hypothesis":"Eliminate dom namespace in node.ts by converting import * as dom to named imports + domCall() helper replacing dom[call] dynamic dispatch. This eliminates the last unnecessary namespace object.","improvement_gzip":-92,"improvement_raw":-558,"key_insight":"The dom[call] dynamic dispatch pattern forced Rollup to keep the entire dom namespace as a runtime object. Replacing with a boolean flag + explicit function calls allows Rollup to inline everything."}}
{"run":66,"commit":"baa0314","metric":24078,"metrics":{"raw_bytes":65971},"status":"discard","description":"core/index.ts named imports - no change, Rollup already inlined","timestamp":1774644254374,"segment":0,"confidence":32.05309734513274,"iterationTokens":4608,"asi":{"hypothesis":"Convert 7 import * as to named imports in core/index.ts","rollback_reason":"No change - Rollup already inlined these since namespaces weren't used as values","note":"Only namespace objects used as VALUES (passed to functions, stored in arrays) create overhead. Method-only usage is already inlined."}}
{"run":67,"commit":"baa0314","metric":24078,"metrics":{"raw_bytes":65971},"status":"discard","description":"Final verification: 24,078 gzip / 65,971 raw. -13.1% gzip from baseline.","timestamp":1774644530034,"segment":0,"confidence":29.93388429752066,"iterationTokens":9198,"asi":{"hypothesis":"Final state verification","note":"Stable at 24,078 gzip / 65,971 raw. Total: -3,622 gzip (-13.1%), -15,626 raw (-19.2%) from baseline. 66 experiments, 31 commits."}}
{"run":68,"commit":"33de32f","metric":24078,"metrics":{"raw_bytes":65971},"status":"keep","description":"Remove unused getId import from node.ts (cleanup)","timestamp":1774644633299,"segment":0,"confidence":29.93388429752066,"iterationTokens":1517,"asi":{"hypothesis":"Remove unused getId import from node.ts to fix TS6133 warning"}}
{"run":69,"commit":"33de32f","metric":24078,"metrics":{"raw_bytes":65971},"status":"discard","description":"Session 7 start: confirmed 24,078 gzip / 65,971 raw (-13.1%)","timestamp":1774644823525,"segment":0,"confidence":29.93388429752066,"iterationTokens":5046,"asi":{"hypothesis":"Session 7 baseline confirmation"}}
{"run":70,"commit":"33de32f","metric":24078,"metrics":{"raw_bytes":65971},"status":"discard","description":"treeshake propertyReadSideEffects:false - no change","timestamp":1774644931414,"segment":0,"confidence":34.33175355450237,"iterationTokens":1885,"asi":{"hypothesis":"treeshake.propertyReadSideEffects:false — safer variant of treeshake tuning","rollback_reason":"No change"}}
