{"type":"config","name":"clarity-js gzipped bundle size optimization","metricName":"gzip_bytes","metricUnit":"bytes","bestDirection":"lower"}
{"run":1,"commit":"7ca9524","metric":27700,"metrics":{"raw_bytes":81597},"status":"keep","description":"Baseline: clarity.min.js = 81,597 raw / 27,700 gzipped","timestamp":1774631535309,"segment":0,"confidence":null,"iterationTokens":652,"asi":{"hypothesis":"baseline measurement","gzip_bytes":27700,"raw_bytes":81597}}
{"run":2,"commit":"6077901","metric":27399,"metrics":{"raw_bytes":80829},"status":"keep","description":"Enhanced terser config: passes=3, pure_getters, unsafe_comps, toplevel. -301 gzipped bytes","timestamp":1774631726898,"segment":0,"confidence":null,"iterationTokens":26997,"asi":{"hypothesis":"Enhanced terser config with passes=3, pure_getters, unsafe_comps, toplevel mangle","improvement_gzip":-301,"improvement_raw":-768}}
{"run":3,"commit":"3cb7d8e","metric":27289,"metrics":{"raw_bytes":80025},"status":"keep","description":"Replace template literals with + concatenation (avoids ES5 .concat()). -110 gzip, -804 raw","timestamp":1774632262962,"segment":0,"confidence":3.7363636363636363,"iterationTokens":1747,"asi":{"hypothesis":"Replace template literals with + concatenation to avoid .concat() in ES5 output","improvement_gzip":-110,"improvement_raw":-804,"files_changed":"selector.ts, encode.ts, scrub.ts, dynamic.ts, measure.ts, task.ts, dom.ts, internal.ts, cookie.ts, upload.ts, metadata.ts, variable.ts, dimension.ts, insight/encode.ts"}}
{"run":4,"commit":"91c121b","metric":27222,"metrics":{"raw_bytes":79225},"status":"keep","description":"Consolidate tokens.push() calls into multi-arg. -67 gzip, -800 raw","timestamp":1774632448413,"segment":0,"confidence":5.401129943502825,"iterationTokens":6492,"asi":{"hypothesis":"Consolidate sequential tokens.push() calls into multi-arg push(a,b,c)","improvement_gzip":-67,"improvement_raw":-800,"total_from_baseline_gzip":-478}}
{"run":5,"commit":"c0a1bbe","metric":25170,"metrics":{"raw_bytes":72524},"status":"keep","description":"Target ES2017 for IIFE builds: eliminates polyfills. -2,052 gzip (-7.5%), -6,701 raw","timestamp":1774632691707,"segment":0,"confidence":23,"iterationTokens":14075,"asi":{"hypothesis":"Target ES2017 for IIFE builds to eliminate __awaiter/__generator polyfills and use native async/await, arrow functions, for-of, let/const","improvement_gzip":-2052,"improvement_raw":-6701,"total_from_baseline_gzip":-2530,"key_insight":"Code already requires ES2017+ APIs (async/await, Map, WeakMap, Promise, MutationObserver etc), so ES5 target only adds polyfill bloat"}}
{"run":6,"commit":"c0a1bbe","metric":25170,"metrics":{"raw_bytes":72524},"status":"discard","description":"ecma:2017 in terser compress - no improvement, identical output","timestamp":1774632873617,"segment":0,"confidence":8.605442176870747,"iterationTokens":2928,"asi":{"hypothesis":"Add ecma:2017 to terser compress options","rollback_reason":"No improvement - identical output","next_action_hint":"Look at source-level code reduction opportunities"}}
{"run":7,"commit":"2fd482d","metric":25061,"metrics":{"raw_bytes":71712},"status":"keep","description":"Deduplicate baseline.ts: Object.assign + updatePointer helper. -109 gzip, -812 raw","timestamp":1774633023742,"segment":0,"confidence":5.52092050209205,"iterationTokens":10514,"asi":{"hypothesis":"Use Object.assign for baseline state copy + extract updatePointer helper to deduplicate buffer.pointer* assignments","improvement_gzip":-109,"improvement_raw":-812,"total_from_baseline_gzip":-2639}}
{"run":8,"commit":"146836a","metric":25011,"metrics":{"raw_bytes":71039},"status":"keep","description":"Refactor proxyStyleRules: extract proxyRule helper. -50 gzip, -673 raw","timestamp":1774633145103,"segment":0,"confidence":2.4138240574506282,"iterationTokens":6935,"asi":{"hypothesis":"Refactor proxyStyleRules in mutation.ts to use helper function for 4 nearly identical CSS rule proxy blocks","improvement_gzip":-50,"improvement_raw":-673,"total_from_baseline_gzip":-2689}}
{"run":9,"commit":"63a7ee1","metric":24982,"metrics":{"raw_bytes":70729},"status":"keep","description":"rollup freeze:false for IIFE outputs - eliminates Object.freeze. -29 gzip, -310 raw","timestamp":1774633476889,"segment":0,"confidence":14.457446808510639,"iterationTokens":16380,"asi":{"hypothesis":"Add freeze:false to rollup IIFE output configs to eliminate Object.freeze() on module namespaces","improvement_gzip":-29,"improvement_raw":-310,"total_from_baseline_gzip":-2718,"note":"Object.freeze on namespace objects is unnecessary in an IIFE where the modules are internal"}}
{"run":10,"commit":"63a7ee1","metric":25066,"metrics":{"raw_bytes":71939},"status":"discard","description":"generatedCode:es2015 - WORSE +84 gzip due to Symbol overhead","timestamp":1774633618463,"segment":0,"confidence":15.6657060518732,"iterationTokens":2562,"asi":{"hypothesis":"generatedCode: 'es2015' for rollup IIFE outputs","rollback_reason":"+84 gzip - ES2015 generated code adds Symbol.toStringTag and other overhead that increases size","next_action_hint":"Try other source-level optimizations"}}
{"run":11,"commit":"63a7ee1","metric":24982,"metrics":{"raw_bytes":70729},"status":"discard","description":"esModule:false - identical output, no improvement","timestamp":1774633896662,"segment":0,"confidence":14.457446808510639,"iterationTokens":11152,"asi":{"hypothesis":"Add esModule:false to eliminate Symbol.toStringTag","rollback_reason":"No change in output","next_action_hint":"Try source-level optimizations in large files like node.ts, dom.ts"}}
{"run":12,"commit":"63a7ee1","metric":24982,"metrics":{"raw_bytes":70729},"status":"discard","description":"interop+externalLiveBindings - no change, IIFE has no external deps","timestamp":1774633993125,"segment":0,"confidence":19.985294117647058,"iterationTokens":1497,"asi":{"hypothesis":"interop:'default' + externalLiveBindings:false","rollback_reason":"No change","next_action_hint":"Focus on source-level code reduction in the largest modules"}}
{"run":13,"commit":"5ba4cb6","metric":24970,"metrics":{"raw_bytes":70716},"status":"keep","description":"terser compress module:true - marginal -12 gzip","timestamp":1774634381658,"segment":0,"confidence":28.4375,"iterationTokens":18301,"asi":{"hypothesis":"Add module:true to terser compress options","improvement_gzip":-12,"improvement_raw":-13,"note":"Marginal improvement - module:true enables additional optimizations for module code"}}
{"run":14,"commit":"5ba4cb6","metric":24972,"metrics":{"raw_bytes":70722},"status":"discard","description":"Hoist excludedPrivacyAttributes - no improvement (+2 gzip)","timestamp":1774634557132,"segment":0,"confidence":29.513513513513512,"iterationTokens":2480,"asi":{"hypothesis":"Hoist excludedPrivacyAttributes array to module scope to avoid re-creation per call","rollback_reason":"+2 gzip - gzip compresses inline better than hoisted","next_action_hint":"Look for more impactful source-level refactors"}}
{"run":15,"commit":"252e362","metric":24950,"metrics":{"raw_bytes":70465},"status":"keep","description":"style.ts: proxyStyleMethod helper + simpler arraysEqual. -20 gzip, -251 raw","timestamp":1774634756654,"segment":0,"confidence":30.21978021978022,"iterationTokens":3929,"asi":{"hypothesis":"Refactor style.ts: extract proxyStyleMethod helper + simplify arraysEqual","improvement_gzip":-20,"improvement_raw":-251,"total_from_baseline_gzip":-2750}}
{"run":16,"commit":"252e362","metric":24973,"metrics":{"raw_bytes":70201},"status":"discard","description":"Shared coordinates() helper - WORSE +23 gzip despite -264 raw","timestamp":1774635149859,"segment":0,"confidence":42.30769230769231,"iterationTokens":1738,"asi":{"hypothesis":"Extract shared coordinates() function from click.ts and pointer.ts into offset.ts","key_insight":"gzip already deduplicates repeated code blocks, so factoring out shared code into helper functions often helps raw size but not gzip size","next_action_hint":"Focus on optimizations that reduce unique content rather than deduplicating repeated patterns","rollback_reason":"+23 gzip despite -264 raw - gzip handles duplication well"}}
{"run":17,"commit":"305c42e","metric":24947,"metrics":{"raw_bytes":70509},"status":"keep","description":"terser hoist_vars:true - marginal -3 gzip","timestamp":1774635259232,"segment":0,"confidence":50.054545454545455,"iterationTokens":1616,"asi":{"hypothesis":"Add hoist_vars:true to terser compress","improvement_gzip":-3,"note":"Within noise range, but hoist_vars should be stable - it hoists var declarations to top of scope"}}
{"run":18,"commit":"305c42e","metric":24952,"metrics":{"raw_bytes":70513},"status":"discard","description":"Replace tags.includes with direct === in privacy - +5 gzip worse","timestamp":1774635400784,"segment":0,"confidence":57.354166666666664,"iterationTokens":3914,"asi":{"hypothesis":"Replace tags.includes() array with direct === comparisons for TextTag privacy check","next_action_hint":"Try other unique-content reduction approaches","rollback_reason":"+5 gzip - direct comparisons are more unique bytes than array method"}}
{"run":19,"commit":"d0ba0e3","metric":24691,"metrics":{"raw_bytes":69444},"status":"keep","description":"ES2020 target for IIFE: optional chaining + nullish coalescing. -256 gzip, -1065 raw","timestamp":1774635508456,"segment":0,"confidence":85.97142857142858,"iterationTokens":993,"asi":{"hypothesis":"Upgrade IIFE TypeScript target from ES2017 to ES2020 for optional chaining, nullish coalescing","improvement_gzip":-256,"improvement_raw":-1065,"key_insight":"ES2020 features like ?. and ?? compile to shorter native syntax instead of polyfill patterns","total_from_baseline_gzip":-3009}}
{"run":20,"commit":"d0ba0e3","metric":24691,"metrics":{"raw_bytes":69444},"status":"discard","description":"ES2022 target - identical to ES2020, no further benefit","timestamp":1774635586660,"segment":0,"confidence":52.78947368421053,"iterationTokens":1131,"asi":{"hypothesis":"ES2022 target vs ES2020","next_action_hint":"ES2020 is the optimal target - no further benefit from newer targets","rollback_reason":"Identical output to ES2020"}}
{"run":21,"commit":"d0ba0e3","metric":24691,"metrics":{"raw_bytes":69444},"status":"discard","description":"unsafe_math terser - no change","timestamp":1774635825383,"segment":0,"confidence":38.08860759493671,"iterationTokens":2117,"asi":{"hypothesis":"unsafe_math terser option","next_action_hint":"Look for remaining unique content to eliminate","rollback_reason":"No change"}}
{"run":22,"commit":"d0ba0e3","metric":24859,"metrics":{"raw_bytes":69440},"status":"discard","description":"treeshake moduleSideEffects:false - WORSE +168 gzip, removed needed code","timestamp":1774636215975,"segment":0,"confidence":36.920245398773005,"iterationTokens":5574,"asi":{"hypothesis":"treeshake moduleSideEffects:false to eliminate unused imports","next_action_hint":"This caused incorrect code elimination - some modules rely on side effects","rollback_reason":"+168 gzip WORSE - removed needed side effects"}}
{"run":23,"commit":"be92dd5","metric":24684,"metrics":{"raw_bytes":69326},"status":"keep","description":"history.ts: proxyHistory helper for pushState/replaceState. -7 gzip, -118 raw","timestamp":1774636387645,"segment":0,"confidence":35.904761904761905,"iterationTokens":5918,"asi":{"hypothesis":"Refactor history.ts: extract proxyHistory helper to deduplicate pushState/replaceState proxy code","improvement_gzip":-7,"improvement_raw":-118}}
{"run":24,"commit":"485079f","metric":24683,"metrics":{"raw_bytes":69303},"status":"keep","description":"animation.ts: simplify overrideAnimationHelper + remove unused vars. -1 gzip","timestamp":1774636568142,"segment":0,"confidence":29.14975845410628,"iterationTokens":2769,"asi":{"hypothesis":"Simplify animation.ts: fix overrideAnimationHelper to iterate over names array, remove 5 unused module-level variables","improvement_gzip":-1,"improvement_raw":-23,"note":"Marginal improvement. Also fixed a functional issue where the original variables were never being set."}}
{"run":25,"commit":"485079f","metric":24683,"metrics":{"raw_bytes":69303},"status":"discard","description":"namespaceToStringTag:false - no change","timestamp":1774636800786,"segment":0,"confidence":26.464912280701753,"iterationTokens":5806,"asi":{"hypothesis":"namespaceToStringTag:false","rollback_reason":"No change"}}
{"run":26,"commit":"485079f","metric":24683,"metrics":{"raw_bytes":69303},"status":"discard","description":"Confirmation run: stable at 24,683 gzip / 69,303 raw. All 29 tests pass.","timestamp":1774637028193,"segment":0,"confidence":19.40192926045016,"iterationTokens":3414,"asi":{"hypothesis":"Confirmation run - verify stability of all optimizations","note":"Output is stable at 24,683 gzip / 69,303 raw. All tests pass."}}
{"run":27,"commit":"9f21762","metric":24668,"metrics":{"raw_bytes":69083},"status":"keep","description":"Rename clarityOverrides→__clr: shorter internal property name. -15 gzip, -220 raw","timestamp":1774637361269,"segment":0,"confidence":15.313131313131313,"iterationTokens":5015,"asi":{"hypothesis":"Rename clarityOverrides to __clr to reduce property name length (20 occurrences * saved chars)","improvement_gzip":-15,"improvement_raw":-220,"note":"clarityOverrides was an internal name attached to window for proxy function storage. Renamed to __clr for compactness."}}
{"run":28,"commit":"592dc1c","metric":24665,"metrics":{"raw_bytes":69055},"status":"keep","description":"Shorten internal DOM property keys. -3 gzip, -28 raw","timestamp":1774637572953,"segment":0,"confidence":15.251256281407036,"iterationTokens":2013,"asi":{"hypothesis":"Shorten internal DOM property names: clarityAnimationId→__clrAId, clarityOperationCount→__clrOCnt, claritySheetId→__clrSId","improvement_gzip":-3,"improvement_raw":-28}}
{"run":29,"commit":"592dc1c","metric":24665,"metrics":{"raw_bytes":69055},"status":"discard","description":"Inline document.ts vars - no change, terser already handles this","timestamp":1774637702355,"segment":0,"confidence":15.175,"iterationTokens":2928,"asi":{"hypothesis":"Inline document.ts compute() variables into Math.max calls","rollback_reason":"No change - terser already eliminates these intermediate vars","key_insight":"Terser with pure_getters and passes=3 already inlines these patterns"}}
{"run":30,"commit":"592dc1c","metric":24665,"metrics":{"raw_bytes":69055},"status":"discard","description":"terser unsafe_undefined - no change","timestamp":1774637994600,"segment":0,"confidence":12.67223382045929,"iterationTokens":10660,"asi":{"hypothesis":"unsafe_undefined terser option to replace void 0 with undefined","rollback_reason":"No change in output"}}
{"run":31,"commit":"8ae15e5","metric":24654,"metrics":{"raw_bytes":69052},"status":"keep","description":"metric.ts: extract init() helper for count/sum dedup. -11 gzip","timestamp":1774638243276,"segment":0,"confidence":11.670498084291188,"iterationTokens":9385,"asi":{"hypothesis":"Extract init() helper in metric.ts to deduplicate metric initialization checks in count/sum/max","improvement_gzip":-11,"improvement_raw":-3}}
{"run":32,"commit":"8ae15e5","metric":24654,"metrics":{"raw_bytes":69052},"status":"discard","description":"terser unsafe_arrows - no change","timestamp":1774638423575,"segment":0,"confidence":11.715384615384615,"iterationTokens":5889,"asi":{"hypothesis":"unsafe_arrows terser to convert functions to arrow functions","rollback_reason":"No change"}}
{"run":33,"commit":"8ae15e5","metric":24653,"metrics":{"raw_bytes":68972},"status":"discard","description":"terser property mangle __clr* - UNSAFE: window.t collision risk","timestamp":1774638609695,"segment":0,"confidence":11.76061776061776,"iterationTokens":3346,"asi":{"hypothesis":"terser mangle.properties with regex /^__clr/ to mangle internal __clr* properties","rollback_reason":"UNSAFE: window.__clr gets mangled to window.t which could collide with other scripts on the page. Property mangling on window-attached properties is dangerous.","key_insight":"Property mangling is only safe for properties that never escape the IIFE scope. Window properties can collide."}}
{"run":34,"commit":"8ae15e5","metric":24654,"metrics":{"raw_bytes":69052},"status":"discard","description":"terser passes=4 - no change from passes=3","timestamp":1774638726383,"segment":0,"confidence":11.829126213592232,"iterationTokens":2871,"asi":{"hypothesis":"Increase terser passes from 3 to 4","rollback_reason":"No change"}}
{"run":35,"commit":"50c643c","metric":24602,"metrics":{"raw_bytes":69006},"status":"keep","description":"Replace indexOf boolean checks with includes() across 27 occurrences. -52 gzip, -46 raw","timestamp":1774639041322,"segment":0,"confidence":12.1015625,"iterationTokens":11455,"asi":{"hypothesis":"Replace indexOf(x)>=0/indexOf(x)<0 with includes(x)/!includes(x) across ~27 occurrences in ~15 files. In ES2020, includes() compiles natively and produces shorter minified output than indexOf-comparison patterns.","improvement_gzip":-52,"improvement_raw":-46,"files_changed":"dom.ts, node.ts, mutation.ts, style.ts, selector.ts, report.ts, fraud.ts, dimension.ts, change.ts, click.ts, internal.ts, snapshot.ts, observer.ts, schema.ts, region.ts, and more"}}
{"run":36,"commit":"099abee","metric":24601,"metrics":{"raw_bytes":68977},"status":"keep","description":"Array.from→[...x] spread in 4 places. -1 gzip, -29 raw","timestamp":1774639162161,"segment":0,"confidence":14.086363636363636,"iterationTokens":3635,"asi":{"hypothesis":"Replace Array.from(x) with [...x] spread syntax in 4 occurrences","improvement_gzip":-1,"improvement_raw":-29}}
{"run":37,"commit":"099abee","metric":24601,"metrics":{"raw_bytes":68977},"status":"discard","description":"1*Time.Second simplify - no change, terser already folds","timestamp":1774639341369,"segment":0,"confidence":16.225130890052355,"iterationTokens":6813,"asi":{"hypothesis":"Simplify 1 * Time.Second to Time.Second in config","rollback_reason":"No change - terser already folds constant multiplication"}}
{"run":38,"commit":"099abee","metric":24603,"metrics":{"raw_bytes":68972},"status":"discard","description":"isNaN simplification - +2 gzip worse","timestamp":1774639472350,"segment":0,"confidence":17.861671469740635,"iterationTokens":3232,"asi":{"hypothesis":"isNaN(x)===false → !isNaN(x)","rollback_reason":"+2 gzip","key_insight":"Terser already converts this optimally for the gzip context"}}
{"run":39,"commit":"099abee","metric":24601,"metrics":{"raw_bytes":68977},"status":"discard","description":"Final confirmation: stable at 24,601 gzip / 68,977 raw. -11.2% from baseline.","timestamp":1774639565295,"segment":0,"confidence":34.43333333333333,"iterationTokens":2020,"asi":{"hypothesis":"Final confirmation run","note":"Stable at 24,601 gzip / 68,977 raw. Total reduction: -3,099 gzip (-11.2%), -12,620 raw (-15.5%). All tests pass."}}
{"run":40,"commit":"9bcfe62","metric":24595,"metrics":{"raw_bytes":68929},"status":"keep","description":"Replace .toString() with \\\"\\\"+x coercion in 6 places. -6 gzip, -48 raw","timestamp":1774639666083,"segment":0,"confidence":33.38709677419355,"iterationTokens":2740,"asi":{"hypothesis":"Replace .toString() with \"\"+x string coercion in 6 places (metadata.ts, consent.ts, observer.ts, encode.ts). \"\"+x minifies to 4 chars vs .toString() which stays 12 chars.","improvement_gzip":-6,"improvement_raw":-48}}
{"run":41,"commit":"9bcfe62","metric":24596,"metrics":{"raw_bytes":68925},"status":"discard","description":"indexOf===0 to startsWith - no improvement (+1 gzip)","timestamp":1774639790384,"segment":0,"confidence":32.68421052631579,"iterationTokens":3651,"asi":{"hypothesis":"Replace indexOf(x)===0 with startsWith(x) in 4 places","rollback_reason":"+1 gzip - startsWith produces same length minified output as indexOf===0 pattern"}}
{"run":42,"commit":"9bcfe62","metric":24595,"metrics":{"raw_bytes":68929},"status":"discard","description":"Resume confirmation: 24,595 gzip / 68,929 raw verified","timestamp":1774639957668,"segment":0,"confidence":32.5130890052356,"iterationTokens":7139,"asi":{"hypothesis":"Resume confirmation - verify current state"}}
{"run":43,"commit":"9bcfe62","metric":24619,"metrics":{"raw_bytes":69041},"status":"discard","description":"terser wrap_iife - WORSE +24 gzip","timestamp":1774640064610,"segment":0,"confidence":32.68421052631579,"iterationTokens":2472,"asi":{"hypothesis":"terser output.wrap_iife: wraps IIFE in parens instead of ! prefix","rollback_reason":"+24 gzip WORSE - changes output wrapping"}}
{"run":44,"commit":"9bcfe62","metric":0,"metrics":{"raw_bytes":68841},"status":"checks_failed","description":"Store Granted/Denied in const vars - FAILS: TDZ due to circular deps","timestamp":1774640257098,"segment":0,"confidence":32.68421052631579,"iterationTokens":4036,"asi":{"hypothesis":"Store frequently used const enum strings (Granted/Denied) in module-level const variables to reduce inlining repetition","key_insight":"FAILS due to TDZ: circular module dependencies cause const variables to be accessed before initialization. const enum inlining avoids this because values are compile-time constants not runtime variables.","rollback_reason":"Tests fail: ReferenceError: Cannot access 'nr' before initialization — circular module deps cause TDZ"}}
{"run":45,"commit":"9bcfe62","metric":24595,"metrics":{"raw_bytes":68929},"status":"discard","description":"terser reduce_vars - no change","timestamp":1774640375063,"segment":0,"confidence":33.75,"iterationTokens":4640,"asi":{"hypothesis":"terser reduce_vars","rollback_reason":"No change"}}
